<?xml version="1.0" encoding="UTF-8"?>
<risposte xmlns:xsi="http://www.w3.org/2001/XMLSchema-instance" xsi:noNamespaceSchemaLocation="./schemaRisposte.xsd">

    <risposta id="1" id_domanda="1" id_utente="1" faq="false" data="2024-06-07">
        <contenuto>
            L'azienda non ha una sede fisica: opera esclusivamente online.
        </contenuto>
        <valutazioni></valutazioni>
    </risposta>

    <risposta id="2" id_domanda="2" id_utente="14" faq="true" data="2024-06-07">
        <contenuto>
            Puoi inserire un indirizzo di consegna diverso prima di ultimare l'acquisto.
        </contenuto>
        <valutazioni>
            <valutazione peso="200" id_utente="1" rating="5"/>
            <valutazione peso="200" id_utente="2" rating="5"/>
            <valutazione peso="55"  id_utente="17" rating="5"/>
        </valutazioni>
    </risposta>
</risposte>
